{"boundary":{"automatic_authority_escalation":false,"dynamic_code":false,"implicit_physical_effects":false,"maximum_event_chain":128,"reflection":false,"runtime_source_compilation":false,"unbounded_loops":false},"debug":{"entities":[{"entity_id":"Player","handlers":[{"event_id":"damage","source_map":[{"instruction":0,"span":{"column":22,"end_offset":434,"line":22,"path":"Player.tevs","start_offset":433}},{"instruction":1,"span":{"column":25,"end_offset":442,"line":22,"path":"Player.tevs","start_offset":436}},{"instruction":2,"span":{"column":34,"end_offset":451,"line":22,"path":"Player.tevs","start_offset":445}},{"instruction":3,"span":{"column":25,"end_offset":451,"line":22,"path":"Player.tevs","start_offset":436}},{"instruction":4,"span":{"column":18,"end_offset":452,"line":22,"path":"Player.tevs","start_offset":429}},{"instruction":5,"span":{"column":9,"end_offset":453,"line":22,"path":"Player.tevs","start_offset":420}},{"instruction":6,"span":{"column":12,"end_offset":471,"line":23,"path":"Player.tevs","start_offset":465}},{"instruction":7,"span":{"column":12,"end_offset":471,"line":23,"path":"Player.tevs","start_offset":465}},{"instruction":8,"span":{"column":22,"end_offset":476,"line":23,"path":"Player.tevs","start_offset":475}},{"instruction":9,"span":{"column":22,"end_offset":476,"line":23,"path":"Player.tevs","start_offset":475}},{"instruction":10,"span":{"column":12,"end_offset":476,"line":23,"path":"Player.tevs","start_offset":465}},{"instruction":11,"span":{"column":12,"end_offset":476,"line":23,"path":"Player.tevs","start_offset":465}},{"instruction":12,"span":{"column":13,"end_offset":503,"line":24,"path":"Player.tevs","start_offset":491}},{"instruction":13,"span":{"column":9,"end_offset":513,"line":23,"path":"Player.tevs","start_offset":462}},{"instruction":14,"span":{"column":5,"end_offset":519,"line":21,"path":"Player.tevs","start_offset":387}}],"span":{"column":5,"end_offset":519,"line":21,"path":"Player.tevs","start_offset":387}},{"event_id":"start","source_map":[{"instruction":0,"span":{"column":13,"end_offset":153,"line":8,"path":"Player.tevs","start_offset":139}},{"instruction":1,"span":{"column":9,"end_offset":154,"line":8,"path":"Player.tevs","start_offset":135}},{"instruction":2,"span":{"column":5,"end_offset":160,"line":7,"path":"Player.tevs","start_offset":116}}],"span":{"column":5,"end_offset":160,"line":7,"path":"Player.tevs","start_offset":116}},{"event_id":"update","source_map":[{"instruction":0,"span":{"column":31,"end_offset":222,"line":12,"path":"Player.tevs","start_offset":208}},{"instruction":1,"span":{"column":9,"end_offset":223,"line":12,"path":"Player.tevs","start_offset":186}},{"instruction":2,"span":{"column":14,"end_offset":246,"line":13,"path":"Player.tevs","start_offset":237}},{"instruction":3,"span":{"column":26,"end_offset":254,"line":13,"path":"Player.tevs","start_offset":249}},{"instruction":4,"span":{"column":14,"end_offset":254,"line":13,"path":"Player.tevs","start_offset":237}},{"instruction":5,"span":{"column":9,"end_offset":255,"line":13,"path":"Player.tevs","start_offset":232}},{"instruction":6,"span":{"column":12,"end_offset":276,"line":14,"path":"Player.tevs","start_offset":267}},{"instruction":7,"span":{"column":30,"end_offset":286,"line":14,"path":"Player.tevs","start_offset":285}},{"instruction":8,"span":{"column":30,"end_offset":286,"line":14,"path":"Player.tevs","start_offset":285}},{"instruction":9,"span":{"column":33,"end_offset":289,"line":14,"path":"Player.tevs","start_offset":288}},{"instruction":10,"span":{"column":33,"end_offset":289,"line":14,"path":"Player.tevs","start_offset":288}},{"instruction":11,"span":{"column":25,"end_offset":290,"line":14,"path":"Player.tevs","start_offset":280}},{"instruction":12,"span":{"column":12,"end_offset":290,"line":14,"path":"Player.tevs","start_offset":267}},{"instruction":13,"span":{"column":12,"end_offset":290,"line":14,"path":"Player.tevs","start_offset":267}},{"instruction":14,"span":{"column":21,"end_offset":319,"line":15,"path":"Player.tevs","start_offset":313}},{"instruction":15,"span":{"column":13,"end_offset":320,"line":15,"path":"Player.tevs","start_offset":305}},{"instruction":16,"span":{"column":9,"end_offset":375,"line":14,"path":"Player.tevs","start_offset":264}},{"instruction":17,"span":{"column":21,"end_offset":364,"line":17,"path":"Player.tevs","start_offset":358}},{"instruction":18,"span":{"column":13,"end_offset":365,"line":17,"path":"Player.tevs","start_offset":350}},{"instruction":19,"span":{"column":5,"end_offset":381,"line":11,"path":"Player.tevs","start_offset":166}}],"span":{"column":5,"end_offset":381,"line":11,"path":"Player.tevs","start_offset":166}}],"span":{"column":1,"end_offset":521,"line":3,"path":"Player.tevs","start_offset":40}}],"source_path":"Player.tevs"},"debug_hash":"6987b7d45cea8ccb97670a5bf6a1690ced498d5ffb0d12d84eb7e84cc6007343","entities":[{"capabilities":[{"capability_id":"animation.play","kind":"effect","parameters":["Text"],"return_type":"Unit"},{"capability_id":"debug.log","kind":"effect","parameters":["Text"],"return_type":"Unit"},{"capability_id":"input.move2d","kind":"observation","parameters":[],"return_type":"Vec2"},{"capability_id":"motion.move2d","kind":"effect","parameters":["Vec2"],"return_type":"Unit"}],"emitted_events":[{"event_id":"died","parameters":[]}],"entity_id":"Player","handlers":[{"event_id":"damage","instruction_budget":8192,"instructions":[{"op":"CONST","type":"Int","value":{"$int":"0"}},{"name":"health","op":"LOAD_STATE","type":"Int"},{"name":"amount","op":"LOAD_PARAM","type":"Int"},{"left_type":"Int","op":"BINARY","operator":"MINUS","result_type":"Int","right_type":"Int"},{"argc":2,"function_id":"max","op":"CALL_PURE","return_type":"Int"},{"name":"health","op":"STORE_STATE","type":"Int"},{"name":"health","op":"LOAD_STATE","type":"Int"},{"op":"CONVERT_INT_TO_RAT"},{"op":"CONST","type":"Int","value":{"$int":"0"}},{"op":"CONVERT_INT_TO_RAT"},{"left_type":"Rat","op":"BINARY","operator":"EQEQ","result_type":"Bool","right_type":"Rat"},{"op":"JUMP_IF_FALSE","target":14},{"argc":0,"argument_types":[],"event_id":"died","op":"EMIT_EVENT"},{"op":"JUMP","target":14},{"op":"RETURN"}],"locals":[],"parameters":[{"name":"amount","type":"Int"}]},{"event_id":"start","instruction_budget":8192,"instructions":[{"op":"CONST","type":"Text","value":"Player ready"},{"argc":1,"capability_id":"debug.log","kind":"effect","op":"CALL_CAPABILITY","return_type":"Unit"},{"op":"RETURN"}],"locals":[],"parameters":[]},{"event_id":"update","instruction_budget":8192,"instructions":[{"argc":0,"capability_id":"input.move2d","kind":"observation","op":"CALL_CAPABILITY","return_type":"Vec2"},{"name":"direction","op":"STORE_LOCAL","type":"Vec2"},{"name":"direction","op":"LOAD_LOCAL","type":"Vec2"},{"name":"speed","op":"LOAD_STATE","type":"Rat"},{"left_type":"Vec2","op":"BINARY","operator":"STAR","result_type":"Vec2","right_type":"Rat"},{"argc":1,"capability_id":"motion.move2d","kind":"effect","op":"CALL_CAPABILITY","return_type":"Unit"},{"name":"direction","op":"LOAD_LOCAL","type":"Vec2"},{"op":"CONST","type":"Int","value":{"$int":"0"}},{"op":"CONVERT_INT_TO_RAT"},{"op":"CONST","type":"Int","value":{"$int":"0"}},{"op":"CONVERT_INT_TO_RAT"},{"argc":2,"function_id":"vec2","op":"CALL_PURE","return_type":"Vec2"},{"left_type":"Vec2","op":"BINARY","operator":"NE","result_type":"Bool","right_type":"Vec2"},{"op":"JUMP_IF_FALSE","target":17},{"op":"CONST","type":"Text","value":"Walk"},{"argc":1,"capability_id":"animation.play","kind":"effect","op":"CALL_CAPABILITY","return_type":"Unit"},{"op":"JUMP","target":19},{"op":"CONST","type":"Text","value":"Idle"},{"argc":1,"capability_id":"animation.play","kind":"effect","op":"CALL_CAPABILITY","return_type":"Unit"},{"op":"RETURN"}],"locals":[{"name":"direction","type":"Vec2"}],"parameters":[]}],"states":[{"initial":{"$int":"100"},"name":"health","type":"Int"},{"initial":{"$rat":["5","1"]},"name":"speed","type":"Rat"}]}],"language_version":"0.2.0","program_id":"PlayerGameplay","schema":"TEV_SCRIPT_PROGRAM_IR_V2","semantic_hash":"f18d1b2428b96bf8c859463ab62a431c654933e65e23c3d8183335506d5adb5d"}
