{"boundary":{"automatic_authority_escalation":false,"dynamic_code":false,"implicit_physical_effects":false,"maximum_event_chain":128,"reflection":false,"runtime_source_compilation":false,"unbounded_loops":false},"debug":{"entities":[{"entity_id":"Chain","handlers":[{"event_id":"internal","source_map":[{"instruction":0,"span":{"column":17,"end_offset":219,"line":12,"path":"EventChain.tevs","start_offset":213}},{"instruction":1,"span":{"column":9,"end_offset":220,"line":12,"path":"EventChain.tevs","start_offset":205}},{"instruction":2,"span":{"column":24,"end_offset":249,"line":13,"path":"EventChain.tevs","start_offset":244}},{"instruction":3,"span":{"column":9,"end_offset":251,"line":13,"path":"EventChain.tevs","start_offset":229}},{"instruction":4,"span":{"column":9,"end_offset":267,"line":14,"path":"EventChain.tevs","start_offset":260}}],"span":{"column":5,"end_offset":273,"line":11,"path":"EventChain.tevs","start_offset":170}},{"event_id":"start","source_map":[{"instruction":0,"span":{"column":33,"end_offset":126,"line":7,"path":"EventChain.tevs","start_offset":125}},{"instruction":1,"span":{"column":33,"end_offset":126,"line":7,"path":"EventChain.tevs","start_offset":125}},{"instruction":2,"span":{"column":36,"end_offset":129,"line":7,"path":"EventChain.tevs","start_offset":128}},{"instruction":3,"span":{"column":36,"end_offset":129,"line":7,"path":"EventChain.tevs","start_offset":128}},{"instruction":4,"span":{"column":28,"end_offset":130,"line":7,"path":"EventChain.tevs","start_offset":120}},{"instruction":5,"span":{"column":9,"end_offset":132,"line":7,"path":"EventChain.tevs","start_offset":101}},{"instruction":6,"span":{"column":23,"end_offset":156,"line":8,"path":"EventChain.tevs","start_offset":155}},{"instruction":7,"span":{"column":9,"end_offset":158,"line":8,"path":"EventChain.tevs","start_offset":141}},{"instruction":8,"span":{"column":5,"end_offset":164,"line":6,"path":"EventChain.tevs","start_offset":82}}],"span":{"column":5,"end_offset":164,"line":6,"path":"EventChain.tevs","start_offset":82}}],"span":{"column":1,"end_offset":275,"line":3,"path":"EventChain.tevs","start_offset":36}}],"source_path":"EventChain.tevs"},"debug_hash":"70e975a440141f156d2c766232cf7f94c4af9ae905f356a937631744bbff1c9c","entities":[{"capabilities":[{"capability_id":"motion.move2d","kind":"effect","parameters":["Vec2"],"return_type":"Unit"}],"emitted_events":[{"event_id":"completed","parameters":["Int"]},{"event_id":"internal","parameters":["Int"]}],"entity_id":"Chain","handlers":[{"event_id":"internal","instruction_budget":8192,"instructions":[{"name":"amount","op":"LOAD_PARAM","type":"Int"},{"name":"value","op":"STORE_STATE","type":"Int"},{"name":"value","op":"LOAD_STATE","type":"Int"},{"argc":1,"argument_types":["Int"],"event_id":"completed","op":"EMIT_EVENT"},{"op":"RETURN"}],"locals":[],"parameters":[{"name":"amount","type":"Int"}]},{"event_id":"start","instruction_budget":8192,"instructions":[{"op":"CONST","type":"Int","value":{"$int":"0"}},{"op":"CONVERT_INT_TO_RAT"},{"op":"CONST","type":"Int","value":{"$int":"0"}},{"op":"CONVERT_INT_TO_RAT"},{"argc":2,"function_id":"vec2","op":"CALL_PURE","return_type":"Vec2"},{"argc":1,"capability_id":"motion.move2d","kind":"effect","op":"CALL_CAPABILITY","return_type":"Unit"},{"op":"CONST","type":"Int","value":{"$int":"7"}},{"argc":1,"argument_types":["Int"],"event_id":"internal","op":"EMIT_EVENT"},{"op":"RETURN"}],"locals":[],"parameters":[]}],"states":[{"initial":{"$int":"0"},"name":"value","type":"Int"}]}],"language_version":"0.2.0","program_id":"EventChain","schema":"TEV_SCRIPT_PROGRAM_IR_V2","semantic_hash":"a362d9b7e2850c8327eb0f6a4cbebf949cb6edb82fb493f980a8c5c8c078aea5"}
